Title,Authors,Abstract,Published Year,Published Month,Journal,Volume,Issue,Pages,Accession Number,DOI,Ref,Covidence #,Study,Notes,Tags
"Dynamically modeling SARS and other newly emerging respiratory illnesses: past, present, and future","Bauch, C. T.; Lloyd-Smith, J. O.; Coffee, M. P.; Galvani, A. P.","The emergence and rapid global spread of the severe acute respiratory syndrome (SARS) coronavirus in 2002-2003 prompted efforts by modelers to characterize SARS epidemiology and inform control policies. We overview and discuss models for emerging infectious diseases (EIDs), provide a critical survey of SARS modeling literature, and discuss promising future directions for research. We reconcile discrepancies between published estimates of the basic reproductive number R0 for SARS (a crucial epidemiologic parameter), discuss insights regarding SARS control measures that have emerged uniquely from a modeling approach, and argue that high priorities for future modeling of SARS and similar respiratory EIDs should include informing quarantine policy and better understanding the impact of population heterogeneity on transmission patterns.",2005,Nov,Epidemiology,16,6,791-801,16222170,,,#6477,Bauch 2005,Exclusion reason: No original estimates/primary data; Thomas Rawson (2024-01-26 04:02:42)(Included): A review of SARS models and their parameters. Will be very good to reference in the write-up; Anne Cori (2019-06-21 06:29:07)(Select): review of SARS dynamic models; ,SARS review
"SARS: screening, disease associations, and response","Baker, S. J.",,2003,May-31,Lancet,361,9372,1905,12788592,10.1016/s0140-6736(03)13508-8,,#6521,Baker 2003,Exclusion reason: No peer review; ,
Guam responds to SARS,"Brinkley, P.; Haddock, R.; O'Mallan, J.; Camacho, P.",,2002,Sep,Pac Health Dialog,9,2,229-32,14736107,,,#6556,Brinkley 2002,Exclusion reason: No parameters of interest/transmission models/historical outbreaks; Anne Cori (2019-09-10 18:27:36)(Select): paper copy in Anne's office; Janetta Skarp (2019-05-22 19:44:26)(Screen): Did not find full paper on Scholar or WoK; ,
SARS transmission and commercial aircraft,"Breugelmans, J. G.; Zucs, P.; Porten, K.; Broll, S.; Niedrig, M.; Ammon, A.; Krause, G.",,2004,Aug,Emerg Infect Dis,10,8,1502-3,15503396,10.3201/eid1008.040093,,#6563,Breugelmans 2004,Exclusion reason: No parameters of interest/transmission models/historical outbreaks; Anne Cori (2019-06-27 17:47:01)(Select): zero seroprevalence; ,
Role of China in the quest to define and control severe acute respiratory syndrome,"Breiman, R. F.; Evans, M. R.; Preiser, W.; Maguire, J.; Schnur, A.; Li, A.; Bekedam, H.; MacKenzie, J. S.","China holds the key to solving many questions crucial to global control of severe acute respiratory syndrome (SARS). The disease appears to have originated in Guangdong Province, and the causative agent, SARS coronavirus, is likely to have originated from an animal host, perhaps sold in public markets. Epidemiologic findings, integral to defining an animal-human linkage, may be confirmed by laboratory studies; once animal host (s) are confirmed, interventions may be needed to prevent further animal-to-human transmission. Community seroprevalence studies may help determine the basis for the decline in disease incidence in Guangdong Province after February 2002. China will also be able to contribute key data about how the causative agent is transmitted and how it is evolving, as well as identifying pivotal factors influencing disease outcome.",2003,Sep,Emerg Infect Dis,9,9,1037-41,14519236,10.3201/eid0909.030390,,#6570,Breiman 2003,Exclusion reason: No parameters of interest/transmission models/historical outbreaks; ,
Theory versus data: how to calculate R0?,"Breban, R.; Vardavas, R.; Blower, S.","To predict the potential severity of outbreaks of infectious diseases such as SARS, HIV, TB and smallpox, a summary parameter, the basic reproduction number R(0), is generally calculated from a population-level model. R(0) specifies the average number of secondary infections caused by one infected individual during his/her entire infectious period at the start of an outbreak. R(0) is used to assess the severity of the outbreak, as well as the strength of the medical and/or behavioral interventions necessary for control. Conventionally, it is assumed that if R(0)>1 the outbreak generates an epidemic, and if R(0)<1 the outbreak becomes extinct. Here, we use computational and analytical methods to calculate the average number of secondary infections and to show that it does not necessarily represent an epidemic threshold parameter (as it has been generally assumed). Previously we have constructed a new type of individual-level model (ILM) and linked it with a population-level model. Our ILM generates the same temporal incidence and prevalence patterns as the population-level model; we use our ILM to directly calculate the average number of secondary infections (i.e., R(0)). Surprisingly, we find that this value of R(0) calculated from the ILM is very different from the epidemic threshold calculated from the population-level model. This occurs because many different individual-level processes can generate the same incidence and prevalence patterns. We show that obtaining R(0) from empirical contact tracing data collected by epidemiologists and using this R(0) as a threshold parameter for a population-level model could produce extremely misleading estimates of the infectiousness of the pathogen, the severity of an outbreak, and the strength of the medical and/or behavioral interventions necessary for control.",2007,Mar-14,PLoS One,2,3,e282,17356693,10.1371/journal.pone.0000282,,#6573,Breban 2007,Exclusion reason: Wrong pathogen/pathogen epidemiology or transmission not the main focus; Isobel Routledge (2019-05-25 02:30:19)(Select): no SARs data used; ,
Interhuman transmissibility of Middle East respiratory syndrome coronavirus: estimation of pandemic risk,"Breban, R.; Riou, J.; Fontanet, A.","BACKGROUND: The new Middle East respiratory syndrome coronavirus (MERS-CoV) infection shares many clinical, epidemiological, and virological similarities with that of severe acute respiratory syndrome (SARS)-CoV. We aimed to estimate virus transmissibility and the epidemic potential of MERS-CoV, and to compare the results with similar findings obtained for prepandemic SARS. METHODS: We retrieved data for MERS-CoV clusters from the WHO summary and subsequent reports, and published descriptions of cases, and took into account 55 of the 64 laboratory-confirmed cases of MERS-CoV reported as of June 21, 2013, excluding cases notified in the previous 2 weeks. To assess the interhuman transmissibility of MERS-CoV, we used Bayesian analysis to estimate the basic reproduction number (R0) and compared it to that of prepandemic SARS. We considered two scenarios, depending on the interpretation of the MERS-CoV cluster-size data. RESULTS: With our most pessimistic scenario (scenario 2), we estimated MERS-CoV R0 to be 0.69 (95% CI 0.50-0.92); by contrast, the R0 for prepandemic SARS-CoV was 0.80 (0.54-1.13). Our optimistic scenario (scenario 1) yielded a MERS-CoV R0 of 0.60 (0.42-0.80). Because of recent implementation of effective contact tracing and isolation procedures, further MERS-CoV transmission data might no longer describe an entire cluster, but only secondary infections directly caused by the index patient. Hence, we calculated that, under scenario 2, eight or more secondary infections caused by the next index patient would translate into a 5% or higher chance that the revised MERS-CoV R0 would exceed 1--ie, that MERS-CoV might have pandemic potential. INTERPRETATION: Our analysis suggests that MERS-CoV does not yet have pandemic potential. We recommend enhanced surveillance, active contact tracing, and vigorous searches for the MERS-CoV animal hosts and transmission routes to human beings. FUNDING: Agence Nationale de la Recherche (Labex Integrative Biology of Emerging Infectious Diseases), and the European Community's Seventh Framework Programme project PREDEMICS.",2013,Aug-24,Lancet,382,9893,694-9,23831141,10.1016/s0140-6736(13)61492-0,,#6574,Breban 2013,Exclusion reason: Wrong pathogen/pathogen epidemiology or transmission not the main focus; ,
The Kermack-McKendrick epidemic model revisited,"Brauer, F.","The Kermack-McKendrick epidemic model of 1927 is an age of infection model, that is, a model in which the infectivity of an individual depends on the time since the individual became infective. A special case, which is formulated as a two-dimensional system of ordinary differential ordinary differential equations, has often been called the Kermack-McKendrick model. One of the products of the SARS epidemic of 2002-2003 was a variety of epidemic models including general contact rates, quarantine, and isolation. These models can be viewed as age of infection epidemic models and analyzed using the approach of the full Kermack-McKendrick model. All these models share the basic properties that there is a threshold between disappearance of the disease and an epidemic outbreak, and that an epidemic will die out without infecting the entire population.",2005,Dec,Math Biosci,198,2,119-31,16135371,10.1016/j.mbs.2005.07.006,,#6580,Brauer 2005,"Exclusion reason: No parameters of interest/transmission models/historical outbreaks; Anne Cori (2019-06-26 23:33:36)(Select): very theoretical and not really designed for SARS, rather ""The purpose of this work is to show that the properties (i) and (ii) hold for an age of infection model closely related to the original KermackMcKendrick model, of which (1) was a special case and thence to conclude that these properties hold for the extended models which have come out of the SARS epidemic. ""; ",
Severe acute respiratory syndrome (SARS): chest radiographic features in children,"Babyn, P. S.; Chu, W. C.; Tsou, I. Y.; Wansaicheong, G. K.; Allen, U.; Bitnun, A.; Chee, T. S.; Cheng, F. W.; Chiu, M. C.; Fok, T. F.; Hon, E. K.; Gahunia, H. K.; Kaw, G. J.; Khong, P. L.; Leung, C. W.; Li, A. M.; Manson, D.; Metreweli, C.; Ng, P. C.; Read, S.; Stringer, D. A.","BACKGROUND: Severe acute respiratory syndrome (SARS) is a recently recognized condition of viral origin associated with substantial morbidity and mortality rates in adults. Little information is available on its radiologic manifestations in children. OBJECTIVE: The goal of this study was to characterize the radiographic presentation of children with SARS. MATERIALS AND METHODS: We abstracted data (n=62) on the radiologic appearance and course of SARS in pediatric patients with suspect (n=25) or probable (n=37) SARS, diagnosed in five hospital sites located in three cities: Toronto, Singapore, and Hong Kong. Available chest radiographs and thoracic CTs were reviewed for the presence of the following radiographic findings: airspace disease, air bronchograms, airways inflammation and peribronchial thickening, interstitial disease, pleural effusion, and hilar adenopathy. RESULTS: A total of 62 patients (suspect=25, probable=37) were evaluated for SARS. Patient ages ranged from 5.5 months to 17 years and 11.5 months (average, 6 years and 10 months) with a female-to-male ratio of 32:30. Forty-one patients (66.1%) were in close contact with other probable, suspect, or quarantined cases; 10 patients (16.1%) had recently traveled to WHO-designated affected areas within 10 days; and 7 patients (11.2%) were transferred from other hospitals that had SARS patients. Three patients, who did not have close/hospital contact or travel history to affected areas, were classified as SARS cases based on their clinical signs and symptoms and on the fact that they were living in an endemic area. The most prominent clinical presentations were fever, with a temperature over 38 degrees C (100%), cough (62.9%), rhinorrhea (22.6%), myalgia (17.7%), chills (14.5%), and headache (11.3%). Other findings included sore throat (9.7%), gastrointestinal symptoms (9.7%), rigor (8.1%), and lethargy (6.5%). In general, fever and cough were the most common clinical presentations amongst younger pediatric SARS cases (age<10 years), whereas, in addition to these symptoms, headache, myalgia, sore throat, chills, and/or rigor were common in older patients (age>/=10 years). The chest radiographs of 35.5% of patients were normal. The most prominent radiological findings that were observed in the remaining patients were areas of consolidation (45.2%), often peripheral with multifocal lesions in 22.6%. Peribronchial thickening was noted on chest radiographs of 14.5% of patients. Pleural effusion was observed only in one patient (age 17 years and 11.5 months), whereas interstitial disease was not observed in any patient. CONCLUSION: In pediatric cases, SARS manifests with nonspecific radiographic features making radiological differentiation difficult, especially from other commonly encountered childhood respiratory viral illnesses causing airspace disease. The radiographic presentation of suspected SARS cases ranged from normal to mild perihilar peribronchial thickening. The radiographic presentations, as expected, were relatively more pronounced in the SARS probable cases.",2004,Jan,Pediatr Radiol,34,1,47-58,14624321,10.1007/s00247-003-1081-8,,#6594,Babyn 2004,Exclusion reason: No parameters of interest/transmission models/historical outbreaks; Anne Cori (2019-06-26 22:25:33)(Select): estimates of hospitalisation period but I think that's it; ,
Severe acute respiratory syndrome,"Aronin, S. I.; Sadigh, M.","Severe acute respiratory syndrome (SARS) is a new respiratory illness due to a novel coronavirus called SARS-CoV. Cases of SARS were first identified from Guangdong Province in southern China in November 2002. Over the next several months, international travel allowed for the rapid spread of >8,000 cases over three continents. The economic and psychological impact of this mysterious illness was profound. In order to better educate the public about this emerging infectious disease, we describe the characteristics of SARS-CoV and review the epidemiology, clinical presentation, laboratory, radiographic and histopathological features, diagnosis, treatment, prevention and infection control issues pertaining to SARS. While a significant amount of information about this disease has been gained in a brief period of time, details regarding the origin of SARS-CoV, its stability in the environment and in human body fluids, and whether it has become established in humans remain unknown.",2004,Apr,Conn Med,68,4,207-15,15095827,,,#6636,Aronin 2004,"Exclusion reason: No original estimates/primary data; Anne Cori (2019-09-09 20:30:43)(Select): paper version from library in Anne's office - says review but no original parameter estimates; Anne Cori (2019-06-26 18:57:42)(Select): no FT
; ",SARS review; Treatment
Transmission of severe acute respiratory syndrome,"Arita, I.; Kojima, K.; Nakane, M.",,2003,Sep,Emerg Infect Dis,9,9,1183-4,14531382,10.3201/eid0909.030471,,#6643,Arita 2003,Exclusion reason: No peer review; ,
A final size relation for epidemic models,"Arino, J.; Brauer, F.; van den Driessche, P.; Watmough, J.; Wu, J.","A final size relation is derived for a general class of epidemic mod els, including models with multiple susceptible classes. The derivation depends on an explicit formula for the basic reproduction number of a general class of disease transmission models, which is extended to calculate the basic reproduction number in models with vertical transmission. Applications are given to specific models for influenza and SARS.",2007,Apr,Math Biosci Eng,4,2,159-75,17658921,,,#6644,Arino 2007,"Exclusion reason: No parameters of interest/transmission models/historical outbreaks; Thomas Rawson (2024-01-31 01:47:48)(Included): Model is just a general SIQR model and it mentions SARS as an example of such a situation. No data or anything actually linking it to SARS in any way, so I kicked it back from extraction.; Mara Kont (2019-06-26 00:02:12)(Select): No primary data but there is a SARS model; ",
Data briefing. Severe acute respiratory syndrome,"Appleby, J.",,2003,May-01,Health Serv J,113,5853,33,12760307,,,#6657,Appleby 2003,"Exclusion reason: No original estimates/primary data; Anne Cori (2019-06-26 18:56:44)(Select): no FT
; ",
Global patterns in coronavirus diversity,"Anthony, S. J.; Johnson, C. K.; Greig, D. J.; Kramer, S.; Che, X.; Wells, H.; Hicks, A. L.; Joly, D. O.; Wolfe, N. D.; Daszak, P.; Karesh, W.; Lipkin, W. I.; Morse, S. S.; Mazet, J. A. K.; Goldstein, T.","Since the emergence of Severe Acute Respiratory Syndrome Coronavirus (SARS-CoV) and Middle East Respiratory Syndrom Coronavirus (MERS-CoV) it has become increasingly clear that bats are important reservoirs of CoVs. Despite this, only 6% of all CoV sequences in GenBank are from bats. The remaining 94% largely consist of known pathogens of public health or agricultural significance, indicating that current research effort is heavily biased towards describing known diseases rather than the 'pre-emergent' diversity in bats. Our study addresses this critical gap, and focuses on resource poor countries where the risk of zoonotic emergence is believed to be highest. We surveyed the diversity of CoVs in multiple host taxa from twenty countries to explore the factors driving viral diversity at a global scale. We identified sequences representing 100 discrete phylogenetic clusters, ninety-one of which were found in bats, and used ecological and epidemiologic analyses to show that patterns of CoV diversity correlate with those of bat diversity. This cements bats as the major evolutionary reservoirs and ecological drivers of CoV diversity. Co-phylogenetic reconciliation analysis was also used to show that host switching has contributed to CoV evolution, and a preliminary analysis suggests that regional variation exists in the dynamics of this process. Overall our study represents a model for exploring global viral diversity and advances our fundamental understanding of CoV biodiversity and the potential risk factors associated with zoonotic emergence.",2017,Jan,Virus Evol,3,1,vex012,28630747,10.1093/ve/vex012,,#6667,Anthony 2017,Exclusion reason: No parameters of interest/transmission models/historical outbreaks; ,
"Epidemiology, transmission dynamics and control of SARS: the 2002-2003 epidemic","Anderson, R. M.; Fraser, C.; Ghani, A. C.; Donnelly, C. A.; Riley, S.; Ferguson, N. M.; Leung, G. M.; Lam, T. H.; Hedley, A. J.","This paper reviews current understanding of the epidemiology, transmission dynamics and control of the aetiological agent of severe acute respiratory syndrome (SARS). We present analyses of data on key parameters and distributions and discuss the processes of data capture, analysis and public health policy formulation during the SARS epidemic are discussed. The low transmissibility of the virus, combined with the onset of peak infectiousness following the onset of clinical symptoms of disease, transpired to make simple public health measures, such as isolating patients and quarantining their contacts, very effective in the control of the SARS epidemic. We conclude that we were lucky this time round, but may not be so with the next epidemic outbreak of a novel aetiological agent. We present analyses that help to further understanding of what intervention measures are likely to work best with infectious agents of defined biological and epidemiological properties. These lessons learnt from the SARS experience are presented in an epidemiological and public health context.",2004,Jul-29,Philos Trans R Soc Lond B Biol Sci,359,1447,1091-105,15306395,10.1098/rstb.2004.1490,,#6682,Anderson 2004,"Exclusion reason: No original estimates/primary data; Janetta Skarp (2019-09-18 20:20:08)(Select): Useful review
; ",SARS review
Travel implications of emerging coronaviruses: SARS and MERS-CoV,"Al-Tawfiq, J. A.; Zumla, A.; Memish, Z. A.",The emergence of Severe Acute Respiratory Syndrome Coronavirus (SARS-CoV) and of the Middle East Syndrome Cornavirus (MERS-CoV) caused widespread fear and concern for their potential threat to global health security. There are similarities and differences in the epidemiology and clinical features between these two diseases. The origin of SARS-COV and MERS-CoV is thought to be an animal source with subsequent transmission to humans. The identification of both the intermediate host and the exact route of transmission of MERS-CoV is crucial for the subsequent prevention of the introduction of the virus into the human population. So far MERS-CoV had resulted in a limited travel-associated human cases with no major events related to the Hajj.,2014,Sep-Oct,Travel Med Infect Dis,12,5,422-8,25047726,10.1016/j.tmaid.2014.06.007,,#6702,Al-Tawfiq 2014,"Exclusion reason: No original estimates/primary data; Thomas Rawson (2024-01-31 05:41:28)(Included): Review, nothing to extract, kick back.; ",SARS review
Surveillance for emerging respiratory viruses,"Al-Tawfiq, J. A.; Zumla, A.; Gautret, P.; Gray, G. C.; Hui, D. S.; Al-Rabeeah, A. A.; Memish, Z. A.","Several new viral respiratory tract infectious diseases with epidemic potential that threaten global health security have emerged in the past 15 years. In 2003, WHO issued a worldwide alert for an unknown emerging illness, later named severe acute respiratory syndrome (SARS). The disease caused by a novel coronavirus (SARS-CoV) rapidly spread worldwide, causing more than 8000 cases and 800 deaths in more than 30 countries with a substantial economic impact. Since then, we have witnessed the emergence of several other viral respiratory pathogens including influenza viruses (avian influenza H5N1, H7N9, and H10N8; variant influenza A H3N2 virus), human adenovirus-14, and Middle East respiratory syndrome coronavirus (MERS-CoV). In response, various surveillance systems have been developed to monitor the emergence of respiratory-tract infections. These include systems based on identification of syndromes, web-based systems, systems that gather health data from health facilities (such as emergency departments and family doctors), and systems that rely on self-reporting by patients. More effective national, regional, and international surveillance systems are required to enable rapid identification of emerging respiratory epidemics, diseases with epidemic potential, their specific microbial cause, origin, mode of acquisition, and transmission dynamics.",2014,Oct,Lancet Infect Dis,14,10,992-1000,25189347,10.1016/s1473-3099(14)70840-0,,#6704,Al-Tawfiq 2014,Exclusion reason: No parameters of interest/transmission models/historical outbreaks; ,
"Challenges presented by MERS corona virus, and SARS corona virus to global health","Al-Hazmi, A.","Numerous viral infections have arisen and affected global healthcare facilities. Millions of people are at severe risk of acquiring several evolving viral infections through several factors. In the present article we have described about risk factors, chance of infection, and prevention methods of Middle East Respiratory Syndrome Coronavirus (MERS-CoV) and severe acute respiratory syndrome (SARS-CoV), human coronaviruses (CoVs) frequently cause a normal cold which is mild and self-restricting. Zoonotic transmission of CoVs such as the newly discovered MERS-CoV and SARS-CoV, may be associated with severe lower respiratory tract infection. The present review provides the recent clinical and pathological information on MERS and SARS. The task is to transform these discoveries about MERS and SARS pathogenesis and to develop intervention methods that will eventually allow the effective control of these recently arising severe viral infections. Global health sector has learnt many lessons through the recent outbreak of MERS and SARS, but the need for identifying new antiviral treatment was not learned. In the present article we have reviewed the literature on the several facets like transmission, precautions and effectiveness of treatments used in patients with MERS-CoV and SARS infections.",2016,Jul,Saudi J Biol Sci,23,4,507-11,27298584,10.1016/j.sjbs.2016.02.019,,#6727,Al-Hazmi 2016,Exclusion reason: No original estimates/primary data; Anne Cori (2019-06-25 21:23:54)(Select): it's a review but mainly on MERS - for SARS not much parameter review - only one number for CFR; ,SARS review
Severe acute respiratory syndrome: the evolution of a new epidemic,"Al-Ateeg, F. A.",,2003,May-Jul,Ann Saudi Med,23,03-Apr,118-26,16985298,,,#6736,Al-Ateeg 2003,"Exclusion reason: No original estimates/primary data; Thomas Rawson (2024-01-31 05:49:33)(Included): review, kicked back; Anne Cori (2019-06-25 21:19:41)(Select): review paper with some refs e.g. on incubation period; ",SARS review
SARS: The emergence of a new epidemic,"Al-Ateeg, F. A.",,2003,Jul,Saudi Med J,24,7,794-8,12883624,,,#6737,Al-Ateeg 2003,"Exclusion reason: No original estimates/primary data; Thomas Rawson (2024-01-31 05:51:33)(Included): another review, kicked back.; Anne Cori (2019-06-25 21:21:22)(Select): no original estimates but reviews some of the evidence eg on incubation period; ",SARS review
