Title,Authors,Abstract,Published Year,Published Month,Journal,Volume,Issue,Pages,Accession Number,DOI,Ref,Covidence #,Study,Notes,Tags
Absence of infection in asymptomatic contacts of index SARS case in France,"Le Vu, S.; Yazdanpanah, Y.; Bitar, D.; Emmanuelli, J.; Bonmarin, I.; Desenclos, J. C.","The first case of severe acute respiratory syndrome (SARS) in France was diagnosed in March 2003. We conducted a serological survey to assess whether or not asymptomatic persons who had been in contact with this patient during his infectious stage had been infected. They were interviewed and asked to provide a blood sample for SARS coronavirus immunoglobulin G antibody testing. Despite the likely high infectivity of the SARS patient, no asymptomatic SARS infection was found in any of the 37 contacts included. These findings support a SARS case definition that is essentially based on clinical and epidemiological assessment, should SARS re-emerge.",2006,Jan,Euro Surveill,11,1,09-Oct,29208086,10.2807/esm.11.01.00593-en,,#3871,LeVu 2006,Exclusion reason: Case report/case study; ,
"Lack of SARS transmission among public hospital workers, Vietnam","Le, D. H.; Bloom, S. A.; Nguyen, Q. H.; Maloney, S. A.; Le, Q. M.; Leitmeyer, K. C.; Bach, H. A.; Reynolds, M. G.; Montgomery, J. M.; Comer, J. A.; Horby, P. W.; Plant, A. J.","The severe acute respiratory syndrome (SARS) outbreak in Vietnam was amplified by nosocomial spread within hospital A, but no transmission was reported in hospital B, the second of two designated SARS hospitals. Our study documents lack of SARS-associated coronavirus transmission to hospital B workers, despite variable infection control measures and the use of personal protective equipment.",2004,Feb,Emerg Infect Dis,10,2,265-8,15030695,10.3201/eid1002.030707,,#3873,Le 2004,"Exclusion reason: No parameters of interest/transmission models/historical outbreaks; Anne Cori (2019-10-18 19:47:17)(Select): again they don't really give an estimate of seroprevalence with proper uncertainty so excluding; Janetta Skarp (2019-09-30 19:51:17)(Select): We care about the population of HCW in particular, right?; ",
"Re: ""A chain multinomial model for estimating the real-time fatality rate of a disease, with an application to severe acute respiratory syndrome""","Lau, E. H.; Yip, P. S.",,2005,Sep-15,Am J Epidemiol,162,6,604-5,16076826,10.1093/aje/kwi239,,#3930,Lau 2005,Exclusion reason: No peer review; ,
Critical care lessons from severe acute respiratory syndrome,"Lapinsky, S. E.; Granton, J. T.","PURPOSE OF REVIEW: Severe acute respiratory syndrome (SARS) is a new disease that caused large outbreaks in several countries in the first half of 2003, resulting in infection in more than 8000 people and more than 900 deaths. During that time, a large body of literature rapidly emerged describing the clinical disease, the etiologic viral agent, and management options. This paper reviews the current status of this knowledge base, with particular reference to the critically ill patient. RECENT FINDINGS: Case series of patients from Hong Kong, China, Singapore, and Toronto have characterized the disease with remarkable uniformity. A similarly consistent picture of the SARS patient with respiratory failure has emerged from studies from Toronto and Singapore. Worldwide collaboration led to the rapid identification and gene sequencing of the etiologic virus, SARS-CoV. SUMMARY: SARS is a predominantly respiratory illness, spread through droplets from respiratory secretions and possibly via a fecal-oral route. A small number of ""super-spreaders"" appear to have contributed to the rapid proliferation of the disease. Infection control precautions are an essential component of management. Approximately 20% of patients develop progressive pulmonary infiltrates and respiratory failure, and the mortality rate is as high as 10%. Treatment strategies with antiviral agents such as ribavirin have not clearly demonstrated a benefit, but high-dose corticosteroids appear to be beneficial in patients with progressive disease. The recent outbreaks highlighted the potential for this disease to overwhelm critical care resources, by the volume of patients and loss of healthcare workers to illness and quarantine.",2004,Feb,Curr Opin Crit Care,10,1,53-8,15166850,,,#3944,Lapinsky 2004,Exclusion reason: No original estimates/primary data; ,SARS review
Molecular epidemiology of severe acute respiratory syndrome-associated coronavirus infections in Taiwan,"Lan, Y. C.; Liu, T. T.; Yang, J. Y.; Lee, C. M.; Chen, Y. J.; Chan, Y. J.; Lu, J. J.; Liu, H. F.; Hsiung, C. A.; Ho, M. S.; Hsiao, K. J.; Chen, H. Y.; Chen, Y. M.","BACKGROUND: In 2003, Taiwan experienced a series of outbreaks of severe acute respiratory syndrome (SARS) and 1 laboratory-contamination accident. Here we describe a new phylogenetic analytical method to study the sources and dissemination paths of SARS-associated coronavirus (SARS-CoV) infections in Taiwan. METHODS: A phylogenetic analytical tool for combining nucleotide sequences from 6 variable regions of a SARS-CoV genome was developed by use of 20 published SARS-CoV sequences; and this method was validated by use of 80 published SARS-CoV sequences. Subsequently, this new tool was applied to provide a better understanding of the entire complement of Taiwanese SARS-CoV isolates, including 20 previously published and 19 identified in this study. The epidemiological data were integrated with the results from the phylogenetic tree and from the nucleotide-signature pattern. RESULTS: The topologies of phylogenetic trees generated by the new and the conventional strategies were similar, with the former having better robustness than the latter, especially in comparison with the maximum-likelihood trees: the new strategy revealed that during 2003 there were 5 waves of epidemic SARS-CoV infection, which belonged to 3 phylogenetic clusters in Taiwan. CONCLUSIONS: The new strategy is more efficient than its conventional counterparts. The outbreaks of SARS in Taiwan originated from multiple sources.",2005,May-01,J Infect Dis,191,9,1478-89,15809907,10.1086/428591,,#3961,Lan 2005,Exclusion reason: No parameters of interest/transmission models/historical outbreaks; ,
Phylogenetic analysis and sequence comparisons of structural and non-structural SARS coronavirus proteins in Taiwan,"Lan, Y. C.; Liu, H. F.; Shih, Y. P.; Yang, J. Y.; Chen, H. Y.; Chen, Y. M.","Taiwan experienced a large number of severe acute respiratory syndrome (SARS) viral infections between March and July 2003; by September of that year, 346 SARS cases were confirmed by RT-PCR or serological tests. In order to better understand evolutionary relationships among SARS coronaviruses (SCoVs) from different international regions, we performed phylogenetic comparisons of full-length genomic and protein sequences from 45 human SCoVs (including 12 from Taiwan) and two civet SCoVs. All the Taiwanese SARS-CoV strains which associated with nosocomial infection formed a monophyletic clade within the late phase of the SARS epidemic. This Taiwanese clade could be further divided into two epidemic waves. Taiwan SCoVs in the first wave clustered with three isolates from the Amoy Gardens housing complex in Hong Kong indicating their possible origin. Of the 45 human SCoVs, one isolate from Guangdong province, China, exhibited an extra 29-nucleotide fragment between Orf 10 and Orf 11--similar to the civet SCoV genome. Nucleotide and protein sequence comparisons suggested that all SCoVs of late epidemic came from human-to-human transmission, while certain SCoVs of early epidemic might have originated in animals.",2005,Apr,Infect Genet Evol,5,3,261-9,15737918,10.1016/j.meegid.2004.08.005,,#3962,Lan 2005,Exclusion reason: No parameters of interest/transmission models/historical outbreaks; ,
Use of phylogenetics in the molecular epidemiology and evolutionary studies of viral infections,"Lam, T. T.; Hon, C. C.; Tang, J. W.","Since DNA sequencing techniques first became available almost 30 years ago, the amount of nucleic acid sequence data has increased enormously. Phylogenetics, which is widely applied to compare and analyze such data, is particularly useful for the analysis of genes from rapidly evolving viruses. It has been used extensively to describe the molecular epidemiology and transmission of the human immunodeficiency virus (HIV), the origins and subsequent evolution of the severe acute respiratory syndrome (SARS)-associated coronavirus (SCoV), and, more recently, the evolving epidemiology of avian influenza as well as seasonal and pandemic human influenza viruses. Recent advances in phylogenetic methods can infer more in-depth information about the patterns of virus emergence, adding to the conventional approaches in viral epidemiology. Examples of this information include estimations (with confidence limits) of the actual time of the origin of a new viral strain or its emergence in a new species, viral recombination and reassortment events, the rate of population size change in a viral epidemic, and how the virus spreads and evolves within a specific population and geographical region. Such sequence-derived information obtained from the phylogenetic tree can assist in the design and implementation of public health and therapeutic interventions. However, application of many of these advanced phylogenetic methods are currently limited to specialized phylogeneticists and statisticians, mainly because of their mathematical basis and their dependence on the use of a large number of computer programs. This review attempts to bridge this gap by presenting conceptual, technical, and practical aspects of applying phylogenetic methods in studies of influenza, HIV, and SCoV. It aims to provide, with minimal mathematics and statistics, a practical overview of how phylogenetic methods can be incorporated into virological studies by clinical and laboratory specialists.",2010,Jan-Feb,Crit Rev Clin Lab Sci,47,1,May-49,20367503,10.3109/10408361003633318,,#3969,Lam 2010,Exclusion reason: No original estimates/primary data; ,Phylogenetic studies; SARS review
A test for constant fatality rate of an emerging epidemic: with applications to severe acute respiratory syndrome in Hong Kong and Beijing,"Lam, K. F.; Deshpande, J. V.; Lau, E. H.; Naik-Nimbalkar, U. V.; Yip, P. S.; Xu, Y.","The etiology, pathogenesis, and prognosis for a newly emerging disease are generally unknown to clinicians. Effective interventions and treatments at the earliest possible times are warranted to suppress the fatality of the disease to a minimum, and inappropriate treatments should be abolished. In this situation, the ability to extract most information out of the data available is critical so that important decisions can be made. Ineffectiveness of the treatment can be reflected by a constant fatality over time while effective treatment normally leads to a decreasing fatality rate. A statistical test for constant fatality over time is proposed in this article. The proposed statistic is shown to converge to a Brownian motion asymptotically under the null hypothesis. With the special features of the Brownian motion, we are able to analyze the first passage time distribution based on a sequential tests approach. This allows the null hypothesis of constant fatality rate to be rejected at the earliest possible time when adequate statistical evidence accumulates. Simulation studies show that the performance of the proposed test is good and it is extremely sensitive in picking up decreasing fatality rate. The proposed test is applied to the severe acute respiratory syndrome data in Hong Kong and Beijing.",2008,Sep,Biometrics,64,3,869-76,18047531,10.1111/j.1541-0420.2007.00935.x,,#3975,Lam 2008,Exclusion reason: No parameters of interest/transmission models/historical outbreaks; Anne Cori (2019-08-29 22:16:16)(Select): they test for temporal changes in CFR and they show CFR over time in a plot but not numbers; ,
Low prevalence of subclinical severe acute respiratory syndrome-associated coronavirus infection among hospital healthcare workers in Hong Kong,"Lai, T. S.; Keung Ng, T.; Seto, W. H.; Yam, L.; Law, K. I.; Chan, J.",We recruited 688 hospital healthcare workers who cared for patients with severe acute respiratory syndrome (SARS) and did not develop the disease in the Hong Kong outbreak in 2003. A questionnaire survey was conducted and serum samples were collected for SARS-associated coronavirus (SARS-CoV) antibody. The high-risk procedures performed and the types of unprotected exposures were recorded for analysis. Only 1 asymptomatic nurse had positive serological test. The result demonstrates the low rate of subclinical SARS-CoV infection in hospital healthcare workers and that the infection control practice against SARS in Hong Kong's hospitals during the outbreak was highly effective.,2005,,Scand J Infect Dis,37,06-Jul,500-3,16012012,10.1080/00365540510033645,,#3983,Lai 2005,Exclusion reason: No parameters of interest/transmission models/historical outbreaks; Anne Cori (2019-08-29 22:14:20)(Select): seroprevalence in NON SYMPTOMATIC HCW so have excluded; ,
Understanding the spatial clustering of severe acute respiratory syndrome (SARS) in Hong Kong,"Lai, P. C.; Wong, C. M.; Hedley, A. J.; Lo, S. V.; Leung, P. Y.; Kong, J.; Leung, G. M.","We applied cartographic and geostatistical methods in analyzing the patterns of disease spread during the 2003 severe acute respiratory syndrome (SARS) outbreak in Hong Kong using geographic information system (GIS) technology. We analyzed an integrated database that contained clinical and personal details on all 1,755 patients confirmed to have SARS from 15 February to 22 June 2003. Elementary mapping of disease occurrences in space and time simultaneously revealed the geographic extent of spread throughout the territory. Statistical surfaces created by the kernel method confirmed that SARS cases were highly clustered and identified distinct disease ""hot spots."" Contextual analysis of mean and standard deviation of different density classes indicated that the period from day 1 (18 February) through day 16 (6 March) was the prodrome of the epidemic, whereas days 86 (15 May) to 106 (4 June) marked the declining phase of the outbreak. Origin-and-destination plots showed the directional bias and radius of spread of superspreading events. Integration of GIS technology into routine field epidemiologic surveillance can offer a real-time quantitative method for identifying and tracking the geospatial spread of infectious diseases, as our experience with SARS has demonstrated.",2004,Nov,Environ Health Perspect,112,15,1550-6,15531441,10.1289/ehp.7117,,#3989,Lai 2004,Exclusion reason: No parameters of interest/transmission models/historical outbreaks; Anne Cori (2019-08-29 22:13:22)(Select): geostatistical model but no transmission model so have excluded; ,
Spatial clustering of SARS in Hong Kong,"Lai, P. C.; Wong, C. M.; Hedley, A. J.; Leung, G. M.","1. Geographic information system (GIS) can be applied during an acute infectious disease outbreak to reveal new geospatial information in addition to standard field epidemiological analyses. 2. When applied in real time during the onset and evolution of an epidemic, GIS can monitor and enhance understanding of the transmission dynamics of an infectious agent, thereby facilitating the design, implementation and evaluation of potential intervention strategies.",2009,Dec,Hong Kong Med J,15 Suppl 9,,17-Sep,20393219,,,#3990,Lai 2009,Exclusion reason: No parameters of interest/transmission models/historical outbreaks; ,
Data-model fusion to better understand emerging pathogens and improve infectious disease forecasting,"LaDeau, S. L.; Glass, G. E.; Hobbs, N. T.; Latimer, A.; Ostfeld, R. S.","Ecologists worldwide are challenged to contribute solutions to urgent and pressing environmental problems by forecasting how populations, communities, and ecosystems will respond to global change. Rising to this challenge requires organizing ecological information derived from diverse sources and formally assimilating data with models of ecological processes. The study of infectious disease has depended on strategies for integrating patterns of observed disease incidence with mechanistic process models since John Snow first mapped cholera cases around a London water pump in 1854. Still, zoonotic and vector-borne diseases increasingly affect human populations, and methods used to successfully characterize directly transmitted diseases are often insufficient. We use four case studies to demonstrate that advances in disease forecasting require better understanding of zoonotic host and vector populations, as well of the dynamics that facilitate pathogen amplification and disease spillover into humans. In each case study, this goal is complicated by limited data, spatiotemporal variability in pathogen transmission and impact, and often, insufficient biological understanding. We present a conceptual framework for data-model fusion in infectious disease research that addresses these fundamental challenges using a hierarchical state-space structure to (1) integrate multiple data sources and spatial scales to inform latent parameters, (2) partition uncertainty in process and observation models, and (3) explicitly build upon existing ecological and epidemiological understanding. Given the constraints inherent in the study of infectious disease and the urgent need for progress, fusion of data and expertise via this type of conceptual framework should prove an indispensable tool.",2011,Jul,Ecol Appl,21,5,1443-60,21830694,,,#4003,LaDeau 2011,Exclusion reason: No original estimates/primary data; Janetta Skarp (2019-09-30 19:06:14)(Select): conceptual model - not applied to any disease; Janetta Skarp (2019-09-30 19:03:27)(Select): has good R0 collation table from other papers ; ,SARS review
Epidemic Models of Contact Tracing: Systematic Review of Transmission Studies of Severe Acute Respiratory Syndrome and Middle East Respiratory Syndrome,"Kwok, K. O.; Tang, A.; Wei, V. W. I.; Park, W. H.; Yeoh, E. K.; Riley, S.","The emergence and reemergence of coronavirus epidemics sparked renewed concerns from global epidemiology researchers and public health administrators. Mathematical models that represented how contact tracing and follow-up may control Severe Acute Respiratory Syndrome (SARS) and Middle East Respiratory Syndrome (MERS) transmissions were developed for evaluating different infection control interventions, estimating likely number of infections as well as facilitating understanding of their likely epidemiology. We reviewed mathematical models for contact tracing and follow-up control measures of SARS and MERS transmission. Model characteristics, epidemiological parameters and intervention parameters used in the mathematical models from seven studies were summarized. A major concern identified in future epidemics is whether public health administrators can collect all the required data for building epidemiological models in a short period of time during the early phase of an outbreak. Also, currently available models do not explicitly model constrained resources. We urge for closed-loop communication between public health administrators and modelling researchers to come up with guidelines to delineate the collection of the required data in the midst of an outbreak and the inclusion of additional logistical details in future similar models.",2019,,Comput Struct Biotechnol J,17,,186-194,30809323,10.1016/j.csbj.2019.01.003,,#4010,Kwok 2019,Exclusion reason: No original estimates/primary data; ,SARS review
Viral aetiology of acute respiratory illnesses in patients with a suspicion of severe acute respiratory syndrome (SARS) in Switzerland,"Kaiser, L.; Deffernez, C.; Thomas, Y.; Koch, D.; Spicher, V. M.; Uckay, I.; Schultze, D.; Siegl, G.; Perrin, L.; Matter, H. C.; Wunderli, W.",,2003,Jul-12,Swiss Med Wkly,133,27-28,400-1,12947530,2003/27/smw-10394,,#4043,Kaiser 2003,Exclusion reason: No parameters of interest/transmission models/historical outbreaks; ,
The SARS threat in Israel: one medical center's experience,"Kagan, I.; Ovadia, K. L.; Gazit, I.; Silner, D.",,2004,Jul-Aug,J Nurs Adm,34,07-Aug,318-21,15303048,,,#4050,Kagan 2004,Exclusion reason: No parameters of interest/transmission models/historical outbreaks; ,
SARS in the Intensive Care Unit,"Joynt, G. M.; Yap, H. Y.","Approximately 20% of patients with severe acute respiratory syndrome (SARS) develop respiratory failure that requires admission to an intensive care unit (ICU). Old age, comorbidity, and elevated lactate dehydrogenase on hospital admission are associated with increased risk for ICU admission. ICU admission usually is late and occurs 8 to 10 days after symptom onset. Acute respiratory distress syndrome occurs in almost all admitted patients and most require mechanical ventilation. ICU admission is associated with significant morbidity, particularly an apparent increase in the incidence of barotrauma and nosocomial sepsis. Long-term mortality for patients admitted to the ICU ranges from 30% to 50%. Many procedures in ICUs pose a high risk for transmission of SARS coronavirus to health care workers. Contact and airborne infection isolation precautions, in addition to standard precautions, should be applied when caring for patients with SARS. Ensuring staff safety is important to maintain staff morale and delivery of adequate services.",2004,Jun,Curr Infect Dis Rep,6,3,228-233,15142487,,,#4059,Joynt 2004,"Exclusion reason: No original estimates/primary data; Janetta Skarp (2019-09-25 22:59:18)(Select): This is a book chapter?
; ",
Bayesian reconstruction of disease outbreaks by combining epidemiologic and genomic data,"Jombart, T.; Cori, A.; Didelot, X.; Cauchemez, S.; Fraser, C.; Ferguson, N.","Recent years have seen progress in the development of statistically rigorous frameworks to infer outbreak transmission trees (""who infected whom"") from epidemiological and genetic data. Making use of pathogen genome sequences in such analyses remains a challenge, however, with a variety of heuristic approaches having been explored to date. We introduce a statistical method exploiting both pathogen sequences and collection dates to unravel the dynamics of densely sampled outbreaks. Our approach identifies likely transmission events and infers dates of infections, unobserved cases and separate introductions of the disease. It also proves useful for inferring numbers of secondary infections and identifying heterogeneous infectivity and super-spreaders. After testing our approach using simulations, we illustrate the method with the analysis of the beginning of the 2003 Singaporean outbreak of Severe Acute Respiratory Syndrome (SARS), providing new insights into the early stage of this epidemic. Our approach is the first tool for disease outbreak reconstruction from genetic data widely available as free software, the R package outbreaker. It is applicable to various densely sampled epidemics, and improves previous approaches by detecting unobserved and imported cases, as well as allowing multiple introductions of the pathogen. Because of its generality, we believe this method will become a tool of choice for the analysis of densely sampled disease outbreaks, and will form a rigorous framework for subsequent methodological developments.",2014,Jan,PLoS Comput Biol,10,1,e1003457,24465202,10.1371/journal.pcbi.1003457,,#4070,Jombart 2014,Exclusion reason: No parameters of interest/transmission models/historical outbreaks; Joseph Hicks (2024-02-24 03:02:18)(Included): Nothing to extract; No transmission model and generation time is a pre-defined distribution.; ,
Ventilation of wards and nosocomial outbreak of severe acute respiratory syndrome among healthcare workers,"Jiang, S.; Huang, L.; Chen, X.; Wang, J.; Wu, W.; Yin, S.; Chen, W.; Zhan, J.; Yan, L.; Ma, L.; Li, J.; Huang, Z.","OBJECTIVE: To identify valid measures for preventing outbreaks of severe acute respiratory syndrome (SARS) among protected healthcare workers in isolation units. METHODS: Architectural factors, admitted SARS cases and infection of healthcare workers in different isolation wards between January 30 and March 30, 2003 were analyzed. RESULTS: Four types of isolation wards were analyzed, including the ward where the thirty-first bed was located on the twelfth floor, the laminar flow ward in the Intensive Care Unit where the tenth bed was located on the fifteenth floor, the ward where the twenty-seventh bed was located on the thirteenth floor of the Lingnan Building, and thirty wards on the fourteenth to eighteenth floors of the Zhongshan Building. The ratios (m(2)/m(3)) of the area of the ventilation windows to the volume of the rooms were 0, 0, 1:95 and 1:40, respectively. Numbers of SARS cases in the wards mentioned above were 1, 1, 1 and 96, respectively. Total times of hospitalization were 43, 168, 110 and 1272 hours, respectively. The infection rates of the healthcare workers in the areas mentioned above were 73.2%, 32.1%, 27.5% and 1.7%, respectively. The difference in the infection rates was of statistical significance. CONCLUSIONS: Isolating SARS cases in wards with good ventilation could reduce the viral load of the ward and might be the key to preventing outbreaks of SARS among healthcare workers along with strict personal protection measures in isolation units.",2003,Sep,Chin Med J (Engl),116,9,1293-7,14527351,,,#4095,Jiang 2003,Exclusion reason: Case report/case study; Janetta Skarp (2019-09-25 21:30:12)(Select): infection rate of HCW could be useful ; ,
