Title,Authors,Abstract,Published Year,Published Month,Journal,Volume,Issue,Pages,Accession Number,DOI,Ref,Covidence #,Study,Notes,Tags
"Epidemiology and cause of severe acute respiratory syndrome (SARS) in Guangdong, People's Republic of China, in February, 2003","Zhong, N. S.; Zheng, B. J.; Li, Y. M.; Poon,; Xie, Z. H.; Chan, K. H.; Li, P. H.; Tan, S. Y.; Chang, Q.; Xie, J. P.; Liu, X. Q.; Xu, J.; Li, D. X.; Yuen, K. Y.; Peiris,; Guan, Y.","BACKGROUND: An epidemic of severe acute respiratory syndrome (SARS) has been associated with an outbreak of atypical pneumonia originating in Guangdong Province, People's Republic of China. We aimed to identify the causative agent in the Guangdong outbreak and describe the emergence and spread of the disease within the province. METHODS: We analysed epidemiological information and collected serum and nasopharyngeal aspirates from patients with SARS in Guangdong in mid-February, 2003. We did virus isolation, serological tests, and molecular assays to identify the causative agent. FINDINGS: SARS had been circulating in other cities of Guangdong Province for about 2 months before causing a major outbreak in Guangzhou, the province's capital. A novel coronavirus, SARS coronavirus (CoV), was isolated from specimens from three patients with SARS. Viral antigens were also directly detected in nasopharyngeal aspirates from these patients. 48 of 55 (87%) patients had antibodies to SARS CoV in their convalescent sera. Genetic analysis showed that the SARS CoV isolates from Guangzhou shared the same origin with those in other countries, and had a phylogenetic pathway that matched the spread of SARS to the other parts of the world. INTERPRETATION: SARS CoV is the infectious agent responsible for the epidemic outbreak of SARS in Guangdong. The virus isolated from patients in Guangdong is the prototype of the SARS CoV in other regions and countries.",2003,Oct-25,Lancet,362,9393,1353-8,14585636,,,#27,Zhong 2003,Exclusion reason: No parameters of interest/transmission models/historical outbreaks; ,
Epidemiology of severe acute respiratory syndrome (SARS): adults and children,"Zhong, N. S.; Wong, G. W.","Severe acute respiratory syndrome (SARS) is a newly described respiratory infection with pandemic potential. The causative agent is a new strain of coronavirus most likely originating from wild animals. This disease first emerged in November 2002 in Guangdong Province, China. Early in the outbreak the infection had been transmitted primarily via household contacts and healthcare settings. In late February 2003 the infection was transmitted to Hong Kong when an infected doctor from the mainland visited there. During his stay in Hong Kong at least 17 guests and visitors were infected at the hotel at which he stayed. By modern day air travel, the infection was rapidly spread to other countries including Vietnam, Singapore and Canada by these infected guests. With the implementation of effective control strategies including early isolation of suspected cases, strict infection control measures in the hospital setting, meticulous contact tracing and quarantine, the outbreak was finally brought under control by July 2003. In addition, there were another two events of SARS in China between the end of December 2003 and January 2004 and from March to May 2004; both were readily controlled without significant patient spread.",2004,Dec,Paediatr Respir Rev,5,4,270-4,15531250,10.1016/j.prrv.2004.07.011,,#30,Zhong 2004,Exclusion reason: No original estimates/primary data; ,SARS review
Management and prevention of SARS in China,"Zhong, N.","The case fatality was the lowest (3.8%) among 1512 cases with severe acute respiratory syndrome (SARS) in Guangdong Province, China. Rational use of corticosteroid, non-invasive ventilation and the integration of traditional Chinese medicine and modern medicine may partly have contributed to the lowest fatality figure. There was a close linkage between civet cats and humans in terms of transmission of SARS. Strict control of the wild-animal market may be significant in preventing a new outbreak of SARS this year.",2004,Jul-29,Philos Trans R Soc Lond B Biol Sci,359,1447,1115-6,15306397,10.1098/rstb.2004.1491,,#34,Zhong 2004,Exclusion reason: No original estimates/primary data; Anne Cori (2023-01-21 03:25:23)(Select): not original research article; Janetta Skarp (2019-10-17 00:06:16)(Select): not sure if CFR here is original; ,
"SARS-related virus predating SARS outbreak, Hong Kong","Zheng, B. J.; Wong, K. H.; Zhou, J.; Wong, K. L.; Young, B. W.; Lu, L. W.; Lee, S. S.","Using immunofluorescence and neutralization assays, we detected antibodies to human severe acute respiratory syndrome-associated coronavirus (SARS-CoV) and/or animal SARS-CoV-like virus in 17 (1.8%) of 938 adults recruited in 2001. This finding suggests that a small proportion of healthy persons in Hong Kong had been exposed to SARS-related viruses at least 2 years before the recent SARS outbreak.",2004,Feb,Emerg Infect Dis,10,2,176-8,15030679,10.3201/eid1002.030533,,#50,Zheng 2004,"Exclusion reason: Wrong pathogen/pathogen epidemiology or transmission not the main focus; Janetta Skarp (2019-10-17 00:24:45)(Select): if I understood correctly, this virus was not necessarily the SARS CoV and serology was not from the outbreak; ",
"Description and clinical treatment of an early outbreak of severe acute respiratory syndrome (SARS) in Guangzhou, PR China","Zhao, Z.; Zhang, F.; Xu, M.; Huang, K.; Zhong, W.; Cai, W.; Yin, Z.; Huang, S.; Deng, Z.; Wei, M.; Xiong, J.; Hawkey, P. M.","Severe acute respiratory syndrome (SARS), now known to be caused by a coronavirus, probably originated in Guangdong province in southern China in late 2002. The first major outbreak occurred in Guangzhou, the capital of Guangdong, between January and March 2003. This study reviews the clinical presentation, laboratory findings and response to four different treatment protocols. Case notes and laboratory findings were analysed and outcome measures were collected prospectively. The SARS outbreak in Guangdong province and the outbreak in Guangzhou associated with hospitals in the city are described, documenting clinical and laboratory features in a cohort of 190 patients randomly allocated to four treatment regimens. Patients were infected by close contact in either family or health-care settings, particularly following procedures likely to generate aerosols of respiratory secretions (e.g. administration of nebulized drugs and bronchoscopy). The earliest symptom was a high fever followed, in most patients, by dyspnoea, cough and myalgia, with 24 % of patients complaining of diarrhoea. The most frequent chest X-ray changes were patchy consolidation with progression to bilateral bronchopneumonia over 5-10 days. Thirty-six cases developed adult respiratory distress syndrome (ARDS), of whom 11 died. There was no response to antibiotics. The best response (no deaths) was seen in the group of 60 patients receiving early high-dose steroids and nasal CPAP (continuous airway positive pressure) ventilation; the other three treatment groups had significant mortality. Cross-infection to medical and nursing staff was completely prevented in one hospital by rigid adherence to barrier precautions during contact with infected patients. The use of rapid case identification and quarantine has controlled the outbreak in Guangzhou, in which more than 350 patients have been infected. Early administration of high-dose steroids and CPAP ventilation appears to offer the best supportive treatment with a reduced mortality compared with other treatment regimens.",2003,Aug,J Med Microbiol,52,Pt 8,715-20,12867568,10.1099/jmm.0.05320-0,,#59,Zhao 2003,Exclusion reason: No parameters of interest/transmission models/historical outbreaks; Janetta Skarp (2019-10-16 21:44:30)(Select): give no. deaths for cases -- can calculate CFR?; ,
A serological survey on neutralizing antibody titer of SARS convalescent sera,"Zhang, J. S.; Chen, J. T.; Liu, Y. X.; Zhang, Z. S.; Gao, H.; Liu, Y.; Wang, X.; Ning, Y.; Liu, Y. F.; Gao, Q.; Xu, J. G.; Qin, C.; Dong, X. P.; Yin, W. D.","A seroepidemiologic study was conducted in North China in 2003 to determine the neutralizing antibody titer of severe acute respiratory syndrome (SARS) convalescent sera. A total of 99 SARS convalescent serum samples were collected from patients from the Inner Mongolia Autonomous Region, Hebei Province, and Beijing 35-180 days after the onset of symptoms. The anti-SARS antibodies were detected by enzyme-linked immunosorbent assay (ELISA), neutralization assay, and Western blot. Eighty-seven serum samples were confirmed to be positive for SARS antibodies. The neutralizing antibody titer of the 87 positive sera was analyzed quantitatively by neutralization assay. The geometric mean titer (GMT) of the 87 convalescent sera was 1:61. The Kolmogorov-Smirnov test showed that the neutralizing antibody titers conform to normal distribution, which suggests that the average anti-SARS antibody level in this study was representative of the convalescent antibody level of the SARS population. This result could be useful for the development and quality control of SARS vaccines.",2005,Oct,J Med Virol,77,2,147-50,16121363,10.1002/jmv.20431,,#144,Zhang 2005,Exclusion reason: No parameters of interest/transmission models/historical outbreaks; Janetta Skarp (2019-10-14 22:27:26)(Select): I agree regarding exclusion. Serum samples come from patients so not representative of general pop.; Anne Cori (2019-09-10 01:53:46)(Select): I wrongly pressed include but think this should be excluded; ,
Estimated timing of the last common ancestor of the SARS coronavirus,"Zeng, F.; Chow, K. Y.; Leung, F. C.",,2003,Dec-18,N Engl J Med,349,25,2469-70,14681521,10.1056/nejm200312183492523,,#181,Zeng 2003,Exclusion reason: No parameters of interest/transmission models/historical outbreaks; ,
The SARS attack on Hong Kong,"Yuen, K. Y.",,2003,Aug,Hong Kong Med J,9,4,302-3,12904622,,,#198,Yuen 2003,Exclusion reason: No peer review; Isobel Routledge (2019-07-10 01:28:40)(Select): commentary : https://www.hkmj.org/system/files/hkm0308p302.pdf; ,
"A climatologic investigation of the SARS-CoV outbreak in Beijing, China","Yuan, J.; Yun, H.; Lan, W.; Wang, W.; Sullivan, S. G.; Jia, S.; Bittles, A. H.","The first cases of severe acute respiratory syndrome (SARS) were identified in November 2002, in Guangdong Province, China. The epidemic spread rapidly within China and internationally, with 8454 recorded infections and 792 deaths by June 15, 2003. Temperature, relative humidity, and wind velocity were the three key meteorological determinants affecting the transmission of SARS. The peak spread of SARS occurred at a mean temperature of 16.9 degrees C (95% CI, 10.7 degrees C to 23.1 degrees C), with a mean relative humidity of 52.2% (95% CI, 33.0% to 71.4%) and wind speed of 2.8 ms(-1) (95% CI, 2.0 to 3.6 ms(-1)). In northern China, these conditions are most likely to occur in the spring and suggest that SARS has a seasonal nature akin to viruses such as influenza and the common cold. A regression equation (Y=218.692-0.698X(t)-2.043X(h)+2.282X(w)) was derived to represent the optimal climatic conditions for the 2003 SARS epidemic. Further investigations in other regions are necessary to verify these results.",2006,May,Am J Infect Control,34,4,234-6,16679182,10.1016/j.ajic.2005.12.006,,#209,Yuan 2006,Exclusion reason: No parameters of interest/transmission models/historical outbreaks; ,
Severe acute respiratory syndrome,"Ziskin, L. Z.",,2003,Jun,N J Med,100,6,11,12854428,,,#257,Ziskin 2003,Exclusion reason: No peer review; ,
Isolation of virus from a SARS patient and genome-wide analysis of genetic mutations related to pathogenesis and epidemiology from 47 SARS-CoV isolates,"Zhu, Y.; Liu, M.; Zhao, W.; Zhang, J.; Zhang, X.; Wang, K.; Gu, C.; Wu, K.; Li, Y.; Zheng, C.; Xiao, G.; Yan, H.; Zhang, J.; Guo, D.; Tien, P.; Wu, J.","Severe acute respiratory syndrome (SARS) caused by SARS-associated coronavirus (SARS-CoV) is a fatal disease. Prevention of future outbreaks is essential and requires understanding pathogenesis and evolution of the virus. We have isolated a SARS-CoV in China and analyzed 47 SARS-CoV genomes with the aims to reveal the evolution trends of the virus and provide insights into understanding pathogenesis and SARS epidemic. Specimen from a SARS patient was inoculated into cell culture. The presence of SARS-CoV was determined by RT-PCR and confirmed by electron microscopy. Virus was isolated followed by the determination of its genome sequences, which were then analyzed by comparing with other 46 SARS-CoV genomes. Genetic mutations with potential implications to pathogenesis and the epidemic were characterized. This viral genome consists of 29,728 nucleotides with overall organization in agreement with that of published isolates. A total of 348 positions were mutated on 47 viral genomes. Among them 22 had mutations in more than three genomes. Hot spots of nucleotide variations and unique trends of mutations were identified on the viral genomes. Mutation rates were different from gene to gene and were correlated well with periodical or geographic characteristics of the epidemic.",2005,Jan,Virus Genes,30,1,93-102,15744567,10.1007/s11262-004-4586-9,,#272,Zhu 2005,Exclusion reason: No parameters of interest/transmission models/historical outbreaks; Mara Kont (2019-10-16 08:06:08)(Select): too detailed?; ,
Determining SARS sub-clinical infection: a longitudinal seroepidemiological study in recovered SARS patients and controls after an outbreak in a general hospital,"Yang, Z.; Wang, S.; Li, Q.; Li, Y.; Wei, M.; Gao, H.; Donovan, C.; Wang, P. P.","A cohort of 67 confirmed SARS patients were prospectively followed for 16 months and were compared with a control population. Serum samples taken at various times were tested for IgG and IgM; dynamic serological changes in these antibodies were described. The positive responses of IgM and IgG antibodies in sera against SARS virus from the first week to the sixth week after onset of the illness in patients with SARS were measured. The ELISA test of IgG antibody was negative in 200 community controls. The positive rate in the SARS high-risk population was 0.61% tested by ELISA and 0.21% by IFA. The high-risk population in this study was defined as those who provided health care and other services to SARS patients during the outbreak. IgG antibody in convalescent serum of patients with SARS revealed an increasing trend, peaking at the 22nd week after onset of illness followed by a slow decline. IgM appeared earlier than IgG and can be better used for early detection. IgG remained at a high level for a much longer period, serving as a good indicator for follow-up and for assessing past exposure. Our results also suggest that sub-clinical infection, if it exists, is very rare.",2009,,Scand J Infect Dis,41,06-Jul,507-10,19396666,10.1080/00365540902919384,,#302,Yang 2009,Exclusion reason: No parameters of interest/transmission models/historical outbreaks; Anne Cori (2019-10-17 21:54:43)(Select): asymptomatic infection is rare; Janetta Skarp (2019-10-16 22:03:26)(Select): SARS amongst HCW; ,
Severe acute respiratory syndrome (SARS): infection control,"Yang, W.",,2003,Apr-19,Lancet,361,9366,1386-7,12711489,10.1016/s0140-6736(03)13053-x,,#312,Yang 2003,Exclusion reason: No peer review; Isobel Routledge (2019-07-10 00:31:03)(Select): correspondence :https://www.thelancet.com/journals/lancet/article/PIIS0140-6736(03)13053-X/fulltext; ,
Corticosteroid treatment of severe acute respiratory syndrome in Hong Kong,"Yam, L. Y.; Lau, A. C.; Lai, F. Y.; Shung, E.; Chan, J.; Wong, V.","BACKGROUND: The patterns of corticosteroids usage in severe acute respiratory syndrome (SARS) and associated treatment outcomes in Hong Kong were studied. METHOD: Patients> or =18 years old who either had not received corticosteroid or had taken corticosteroids within 14 days from symptom onset were included. Patients receiving corticosteroids beyond 15 days or other investigational treatment within 21 days from symptom onset were excluded. Of 1313 eligible patients, 1287 with major corticosteroid dosage-type combinations were analysed. RESULTS: Crude death rate was lower among 1188 steroid-treated patients compared to 99 patients in Group No Steroid (17.0% vs. 28.3%). Among four corticosteroid groups studied, mortality was lowest in the low-dose oral prednisolone (Group P) and high-dose methylprednisolone (Group MP) groups. On multivariate analysis of the corticosteroid groups, independent factors related to death were: corticosteroid group, older age, co-morbidity, worse chest X-ray score, worse respiratory status at Days 8-10 and higher admission white cell count. Again Groups P and MP had significantly lower adjusted odds ratios for death and lower bacterial and fungal culture rates. Despite worse chest X-ray scores and higher cumulative corticosteroid dosages in Group MP compared to Group P, fewer patients required rescue pulsed corticosteroid. Patients on hydrocortisone (Group HC) had the highest positive culture rates. CONCLUSION: We speculate that corticosteroid with higher in-vitro inflammatory potency administered at timing and dosages commensurate with disease severity may be conducive to better outcome from SARS as a consequence of more effective control of immunopathological lung damage.",2007,Jan,J Infect,54,1,28-39,16542729,10.1016/j.jinf.2006.01.005,,#369,Yam 2007,Exclusion reason: No parameters of interest/transmission models/historical outbreaks; Janetta Skarp (2019-10-15 22:16:21)(Select): More about risks of death. CFR given between two different groups. Including in case we want CFRs for such specific groups but I am kind of doubting it. ; ,Treatment
Spatial pattern of severe acute respiratory syndrome in-out flow in 2003 in Mainland China,"Xu, C.; Wang, J.; Wang, L.; Cao, C.","BACKGROUND: Severe acute respiratory syndrome (SARS) spread to 32 countries and regions within a few months in 2003. There were 5327 SARS cases from November 2002 to May 2003 in Mainland China, which involved 29 provinces, resulted in 349 deaths, and directly caused economic losses of $18.3 billion. METHODS: This study used an in-out flow model and flow mapping to visualize and explore the spatial pattern of SARS transmission in different regions. In-out flow is measured by the in-out degree and clustering coefficient of SARS. Flow mapping is an exploratory method of spatial visualization for interaction data. RESULTS: The findings were as follows. (1) SARS in-out flow had a clear hierarchy. It formed two main centers, Guangdong in South China and Beijing in North China, and two secondary centers, Shanxi and Inner Mongolia, both connected to Beijing. (2) ""Spring Festival travel"" strengthened external flow, but ""SARS panic effect"" played a more significant role and pushed the external flow to the peak. (3) External flow and its three typical kinds showed obvious spatial heterogeneity, such as self-spreading flow (spatial displacement of SARS cases only within the province or municipality of onset and medical locations); hospitalized flow (spatial displacement of SARS cases that had been seen by a hospital doctor); and migrant flow (spatial displacement of SARS cases among migrant workers). (4) Internal and external flow tended to occur in younger groups, and occupational differentiation was particularly evident. Low-income groups of male migrants aged 19-35 years were the main routes of external flow. CONCLUSIONS: During 2002-2003, SARS in-out flow played an important role in countrywide transmission of the disease in Mainland China. The flow had obvious spatial heterogeneity, which was influenced by migrants' behavior characteristics. In addition, the Chinese holiday effect led to irregular spread of SARS, but the panic effect was more apparent in the middle and late stages of the epidemic. These findings constitute valuable input to prevent and control future serious infectious diseases like SARS.",2014,Dec-31,BMC Infect Dis,14,,721,25551367,10.1186/s12879-014-0721-y,,#405,Xu 2014,Exclusion reason: No parameters of interest/transmission models/historical outbreaks; ,
"Serological Evidence of Bat SARS-Related Coronavirus Infection in Humans, China","Wang, N.; Li, S. Y.; Yang, X. L.; Huang, H. M.; Zhang, Y. J.; Guo, H.; Luo, C. M.; Miller, M.; Zhu, G.; Chmura, A. A.; Hagan, E.; Zhou, J. H.; Zhang, Y. Z.; Wang, L. F.; Daszak, P.; Shi, Z. L.",,2018,Feb,Virol Sin,33,1,104-107,29500691,10.1007/s12250-018-0012-7,,#498,Wang 2018,"Exclusion reason: Wrong pathogen/pathogen epidemiology or transmission not the main focus; Isobel Routledge (2019-10-10 02:07:31)(Select): not SARS,  although appear to test for some sort of reactivity to recombinant RBD
proteins  from SARS, but only on samples which were seropositive to SARS related COVs - so not true negative seroprevalence either. Although interesting to note bat-human spillover  for SARs related HCOVs is estimated.; ",
Changing virulence of the SARS virus: the epidemiological evidence,"Wang, M. D.; Jolly, A. M.",,2004,Jul,Bull World Health Organ,82,7,547-8,15500287,,,#500,Wang 2004,"Exclusion reason: No original estimates/primary data; Janetta Skarp (2019-04-10 23:29:40)(Screen): Severe acute respiratory syndrome (SARS) is a newly described, deadly, communicable disease, first manifested in an epidemic that started in November 2002 in Guangdong Province, China (1). A medical professional who had worked with SARS patients in Guangdong visited Hong Kong on 21 February 2003. The disease quickly spread to 26 countries with local transmission in Singapore, Hanoi, Hong Kong and Toronto. The agent of SARS is an RNA coronavirus, not seen before in humans, known as SARS-CoV (1). The virus has been isolated from specimens (2); the genome has been sequenced (3); and infectivity in monkeys has been demonstrated. At the end of the 2003 epidemic, 8098 possible cases and 744 deaths were reported to WHO (4).

Although SARS has been controlled, the potential evolution of this virus is not well understood. This paper reviews the epidemiological characteristics of the epidemic; inconsistencies in transmissibility and mortality, the molecular epidemiology of SARS-CoV (4), the results of mathematical modelling, and evidence of evolution towards virulence in pathogens in similar settings.

https://www.scielosp.org/scielo.php?pid=S0042-96862004000700013&script=sci_arttext&tlng=en; ",SARS review
Retrospective serological investigation of severe acute respiratory syndrome coronavirus antibodies in recruits from mainland China,"Yu, S.; Qiu, M.; Chen, Z.; Ye, X.; Gao, Y.; Wei, A.; Wang, X.; Yang, L.; Wang, J.; Wen, J.; Song, Y.; Pei, D.; Dai, E.; Guo, Z.; Cao, C.; Wang, J.; Yang, R.","Different assays were used to analyze 1,621 serum specimens collected from military recruits from the People's Republic of China in 2002 for severe acute respiratory syndrome (SARS) coronavirus antibodies. The results demonstrated that the subjects either had rarely been exposed to the virus before the 2003 SARS outbreak or had not been exposed but the nucleocapsid protein cross-reacted with other antibodies in humans.",2005,Apr,Clin Diagn Lab Immunol,12,4,552-4,15817766,10.1128/cdli.12.4.552-554.2005,,#516,Yu 2005,Exclusion reason: No parameters of interest/transmission models/historical outbreaks; Janetta Skarp (2019-10-17 00:21:35)(Select): serology not from the outbreak; ,
The epidemiology of the outbreak of severe acute respiratory syndrome (SARS) in Hong Kong--what we do know and what we don't,"Yu, I. T.; Sung, J. J.","Severe acute respiratory syndrome (SARS) struck Hong Kong bitterly in the spring of 2003, infecting 1755 persons and claiming nearly 300 lives. The epidemic was introduced by travellers from southern China, where the disease had originated. It started in late February and lasted until early June. Two notable 'super-spreading' events were reported, one inside a teaching hospital and the other in a private housing estate. Other than in the super-spreading events, the infectivity in the community appeared to be low, and there were few, if any, asymptomatic or subclinical infections. Health-care workers were at particular risk and accounted for 22 % of all probable cases. The main modes of transmission were through droplet spread and close/direct contacts, but situations conducive to aerosol generation appeared to be associated with higher risk. Our review suggests that there are still many unknown factors concerning the mode of transmission and environmental risk that need to be clarified.",2004,Oct,Epidemiol Infect,132,5,781-6,15473139,,,#524,Yu 2004,Exclusion reason: No original estimates/primary data; ,SARS review
Severe acute respiratory syndrome beyond Amoy Gardens: completing the incomplete legacy,"Yu, I. T.; Qiu, H.; Tse, L. A.; Wong, T. W.","The temporal and spatial distributions of the 2003 severe acute respiratory syndrome (SARS) outbreak in Amoy Gardens of Hong Kong was reexamined using all confirmed cases. The outbreak actually extended to nearby residential complexes. Airborne spread was the most likely explanation, and the SARS coronavirus could have spread over a distance of 200 m.",2014,Mar,Clin Infect Dis,58,5,683-6,24319085,10.1093/cid/cit797,,#525,Yu 2014,Exclusion reason: No parameters of interest/transmission models/historical outbreaks; ,
